{
  "module": "MyEvaluations.Business.Mail",
  "generatedAt": "2026-02-20T16:00:00.000Z",
  "isPriority": false,
  "overview": "The Mail module provides data models for training event and seminar email notifications within the MyEvaluations platform. It defines the information structures used when sending email communications about training events and seminars to program participants. This is a lightweight module with 3 classes focused on data representation rather than email sending logic (which resides in companion modules like MailGunService and the Utilities email infrastructure).",
  "architecture": "## Overview\n\nThe Mail module provides data models for training event and seminar email notifications within the MyEvaluations platform. It defines the information structures used when sending email communications about training events and seminars to program participants. This is a lightweight module with 3 classes focused on data representation rather than email sending logic (which resides in companion modules like MailGunService and the Utilities email infrastructure).\n\n## Key Classes\n\n- **TrainingEventsInfo**: Data transfer object representing training event details used in email notifications -- likely includes event name, date, location, participants, and notification metadata.\n- **TrainingSeminarInfo**: Data transfer object representing training seminar details for email communications -- similar to TrainingEventsInfo but specific to seminar-type training activities.\n- **Settings**: Auto-generated application settings class from Visual Studio designer, storing mail-related configuration (SMTP settings, sender addresses, template paths).\n\n## Patterns\n\n- **Info/DTO pattern**: Both `TrainingEventsInfo` and `TrainingSeminarInfo` follow the Info naming convention as pure data transfer objects, carrying training event data between the business layer and the email sending infrastructure.\n- **No Manager/Info pattern**: Despite having Info classes, there are no corresponding Manager classes in this module. The Info classes here serve as email DTOs rather than database-mapped entities.\n- **Separation of concerns**: Email data models are isolated from email sending logic, which lives in separate modules (MailGunService, Utilities).\n- **Configuration-driven**: The `Settings` class suggests configurable mail parameters per deployment environment.\n\n## Notes\n\n- This module has **no stored procedure calls** -- it is purely a data model library for email-related information.\n- The `TrainingEventsInfo` and `TrainingSeminarInfo` classes are likely consumed by email template rendering and notification dispatching services in other modules.\n- During NestJS migration, these DTOs could become TypeScript interfaces or class-validator decorated DTOs in a shared notifications module.\n- The separation between Mail (data models), MailGunService (sending), and Utilities (email scheduling) suggests the email infrastructure evolved organically and could be consolidated during migration.\n- Training events and seminars are key components of CME (Continuing Medical Education) and GME program compliance tracking.\n\n---\n*This documentation was auto-generated from source code analysis. Last updated: 2026-02-20T16:00:00.000Z*",
  "managerPattern": "No Manager pattern",
  "storedProcedures": "",
  "keyClasses": [
    {
      "name": "TrainingEventsInfo",
      "purpose": "Data transfer object representing training event details used in email notifications",
      "keyMethods": []
    },
    {
      "name": "TrainingSeminarInfo",
      "purpose": "Data transfer object representing training seminar details for email communications",
      "keyMethods": []
    },
    {
      "name": "Settings",
      "purpose": "Auto-generated application settings storing mail-related configuration (SMTP, sender addresses, templates)",
      "keyMethods": []
    }
  ],
  "businessRules": [],
  "migrationNotes": [
    "No stored procedure calls -- purely a data model library for email-related information",
    "DTOs could become TypeScript interfaces or class-validator decorated DTOs in a shared notifications module",
    "Email infrastructure (Mail, MailGunService, Utilities) evolved organically and could be consolidated during migration",
    "Training events and seminars are key CME/GME compliance tracking components"
  ],
  "mermaidDiagram": null,
  "mdxContent": "---\ntitle: \"MyEvaluations.Business.Mail\"\ndescription: \"Auto-generated documentation for the MyEvaluations.Business.Mail module\"\nsidebar_label: \"Mail\"\ntags: [dotnet, business-layer]\n---\n\n{/* Auto-generated by ai-enrich-dotnet.ts on 2026-02-20T16:00:00.000Z */}\n\n## Overview\n\nThe Mail module provides data models for training event and seminar email notifications within the MyEvaluations platform. It defines the information structures used when sending email communications about training events and seminars to program participants. This is a lightweight module with 3 classes focused on data representation rather than email sending logic (which resides in companion modules like MailGunService and the Utilities email infrastructure).\n\n## Key Classes\n\n- **TrainingEventsInfo**: Data transfer object representing training event details used in email notifications -- likely includes event name, date, location, participants, and notification metadata.\n- **TrainingSeminarInfo**: Data transfer object representing training seminar details for email communications -- similar to TrainingEventsInfo but specific to seminar-type training activities.\n- **Settings**: Auto-generated application settings class from Visual Studio designer, storing mail-related configuration (SMTP settings, sender addresses, template paths).\n\n## Patterns\n\n- **Info/DTO pattern**: Both `TrainingEventsInfo` and `TrainingSeminarInfo` follow the Info naming convention as pure data transfer objects, carrying training event data between the business layer and the email sending infrastructure.\n- **No Manager/Info pattern**: Despite having Info classes, there are no corresponding Manager classes in this module. The Info classes here serve as email DTOs rather than database-mapped entities.\n- **Separation of concerns**: Email data models are isolated from email sending logic, which lives in separate modules (MailGunService, Utilities).\n- **Configuration-driven**: The `Settings` class suggests configurable mail parameters per deployment environment.\n\n## Notes\n\n- This module has **no stored procedure calls** -- it is purely a data model library for email-related information.\n- The `TrainingEventsInfo` and `TrainingSeminarInfo` classes are likely consumed by email template rendering and notification dispatching services in other modules.\n- During NestJS migration, these DTOs could become TypeScript interfaces or class-validator decorated DTOs in a shared notifications module.\n- The separation between Mail (data models), MailGunService (sending), and Utilities (email scheduling) suggests the email infrastructure evolved organically and could be consolidated during migration.\n- Training events and seminars are key components of CME (Continuing Medical Education) and GME program compliance tracking.\n\n---\n*This documentation was auto-generated from source code analysis. Last updated: 2026-02-20T16:00:00.000Z*"
}
